[
  {
    "schema": "question_event@1",
    "run_id": "run-20261022-a1",
    "seq": 1,
    "at": "2026-10-22T10:00:00Z",
    "type": "state",
    "data": {
      "state": "queued"
    }
  },
  {
    "schema": "question_event@1",
    "run_id": "run-20261022-a1",
    "seq": 2,
    "at": "2026-10-22T10:00:01Z",
    "type": "state",
    "data": {
      "state": "running"
    }
  },
  {
    "schema": "question_event@1",
    "run_id": "run-20261022-a1",
    "seq": 3,
    "at": "2026-10-22T10:00:01Z",
    "type": "stage",
    "data": {
      "stage": "plan",
      "state": "begin"
    }
  },
  {
    "schema": "question_event@1",
    "run_id": "run-20261022-a1",
    "seq": 4,
    "at": "2026-10-22T10:00:05Z",
    "type": "plan",
    "data": {
      "plan": {
        "schema": "question_plan@1",
        "run_id": "run-20261022-a1",
        "version": 1,
        "parent_version": null,
        "created_at": "2026-10-22T10:00:05Z",
        "source": "model",
        "question": "基于深度学习的雷达回波外推降水临近预报（0–2 小时）有哪些主要方法？",
        "lang": "zh",
        "reformulation": "Deep learning methods for radar-echo extrapolation in precipitation nowcasting at 0–2 hour lead times.",
        "subject_terms": [
          "precipitation nowcasting",
          "radar echo extrapolation"
        ],
        "method_terms": [
          "deep learning",
          "recurrent neural network"
        ],
        "outcome_terms": [
          "forecast skill",
          "CSI"
        ],
        "keyword_layers": {
          "canonical": [
            "radar echo extrapolation",
            "optical flow nowcasting"
          ],
          "mainstream": [
            "ConvLSTM precipitation nowcasting",
            "U-Net radar nowcasting"
          ],
          "emerging": [
            "generative precipitation nowcasting",
            "diffusion model nowcasting"
          ],
          "method_centric": [
            "spatiotemporal sequence prediction"
          ],
          "cross_domain": [
            "video prediction"
          ]
        },
        "queries": [
          {
            "id": "q1",
            "query": "\"precipitation nowcasting\" \"deep learning\" radar",
            "layer": "canonical",
            "priority": 1
          },
          {
            "id": "q2",
            "query": "\"radar echo extrapolation\" neural network",
            "layer": "canonical",
            "priority": 2
          },
          {
            "id": "q3",
            "query": "generative \"precipitation nowcasting\"",
            "layer": "emerging",
            "priority": 3
          }
        ],
        "year_from": 2012,
        "year_to": null,
        "criteria": {
          "include": [
            "Proposes, evaluates or benchmarks a data-driven method for radar-based precipitation nowcasting up to a few hours ahead"
          ],
          "exclude": [
            "Seasonal or climate-scale forecasting",
            "Rain gauge interpolation without a forecast"
          ]
        },
        "rationale": "Anchored on radar nowcasting, from extrapolation baselines to generative models.",
        "llm": {
          "model": "strata-qwen",
          "input_tokens": 1840,
          "output_tokens": 612,
          "duration_ms": 9400,
          "calls": 1
        }
      }
    }
  },
  {
    "schema": "question_event@1",
    "run_id": "run-20261022-a1",
    "seq": 5,
    "at": "2026-10-22T10:00:05Z",
    "type": "stage",
    "data": {
      "stage": "plan",
      "state": "end"
    }
  },
  {
    "schema": "question_event@1",
    "run_id": "run-20261022-a1",
    "seq": 6,
    "at": "2026-10-22T10:00:15Z",
    "type": "stage",
    "data": {
      "stage": "search",
      "state": "begin"
    }
  },
  {
    "schema": "question_event@1",
    "run_id": "run-20261022-a1",
    "seq": 7,
    "at": "2026-10-22T10:00:16Z",
    "type": "hit",
    "data": {
      "query_id": "q1",
      "rank": 1,
      "paper": {
        "key": "openalex:W1485009520",
        "keys": [
          "openalex:W1485009520",
          "doi:10.48550/arxiv.1506.04214",
          "arxiv:1506.04214"
        ],
        "title": "Convolutional LSTM Network: A Machine Learning Approach for Precipitation Nowcasting",
        "year": 2015,
        "authors": [
          "Xingjian Shi",
          "Zhourong Chen",
          "Hao Wang",
          "Dit-Yan Yeung",
          "Wai-kin Wong",
          "Wang-chun Woo"
        ],
        "venue": null,
        "type": "preprint",
        "cited_by_count": 6648,
        "abstract": null,
        "keywords": [
          "precipitation nowcasting",
          "convolutional LSTM"
        ],
        "url": "https://arxiv.org/abs/1506.04214",
        "in_archive": true
      },
      "new": true
    }
  },
  {
    "schema": "question_event@1",
    "run_id": "run-20261022-a1",
    "seq": 8,
    "at": "2026-10-22T10:00:18Z",
    "type": "hit",
    "data": {
      "query_id": "q2",
      "rank": 4,
      "paper": {
        "key": "openalex:W1485009520",
        "keys": [
          "openalex:W1485009520",
          "doi:10.48550/arxiv.1506.04214",
          "arxiv:1506.04214"
        ],
        "title": "Convolutional LSTM Network: A Machine Learning Approach for Precipitation Nowcasting",
        "year": 2015,
        "authors": [
          "Xingjian Shi",
          "Zhourong Chen",
          "Hao Wang",
          "Dit-Yan Yeung",
          "Wai-kin Wong",
          "Wang-chun Woo"
        ],
        "venue": null,
        "type": "preprint",
        "cited_by_count": 6648,
        "abstract": null,
        "keywords": [
          "precipitation nowcasting",
          "convolutional LSTM"
        ],
        "url": "https://arxiv.org/abs/1506.04214",
        "in_archive": true
      },
      "new": false
    }
  },
  {
    "schema": "question_event@1",
    "run_id": "run-20261022-a1",
    "seq": 9,
    "at": "2026-10-22T10:00:20Z",
    "type": "hit",
    "data": {
      "query_id": "q3",
      "rank": 1,
      "paper": {
        "key": "openalex:W3202525453",
        "keys": [
          "openalex:W3202525453",
          "doi:10.1038/s41586-021-03854-z"
        ],
        "title": "Skilful precipitation nowcasting using deep generative models of radar",
        "year": 2021,
        "authors": [
          "Suman Ravuri"
        ],
        "venue": "Nature",
        "type": "article",
        "cited_by_count": 916,
        "keywords": [
          "precipitation nowcasting",
          "generative model"
        ],
        "url": "https://doi.org/10.1038/s41586-021-03854-z",
        "in_archive": false
      },
      "new": true
    }
  },
  {
    "schema": "question_event@1",
    "run_id": "run-20261022-a1",
    "seq": 10,
    "at": "2026-10-22T10:00:20Z",
    "type": "hit",
    "data": {
      "query_id": "q3",
      "rank": 2,
      "paper": {
        "key": "openalex:W3145849805",
        "keys": [
          "openalex:W3145849805",
          "arxiv:2104.00954"
        ],
        "title": "Skillful Precipitation Nowcasting using Deep Generative Models of Radar",
        "year": 2021,
        "authors": [
          "Suman Ravuri"
        ],
        "cited_by_count": 30,
        "keywords": [],
        "in_archive": false
      },
      "new": true
    }
  },
  {
    "schema": "question_event@1",
    "run_id": "run-20261022-a1",
    "seq": 11,
    "at": "2026-10-22T10:00:40Z",
    "type": "error",
    "data": {
      "stage": "search",
      "message": "essaies search timed out",
      "fatal": false,
      "query_id": "q4"
    }
  },
  {
    "schema": "question_event@1",
    "run_id": "run-20261022-a1",
    "seq": 12,
    "at": "2026-10-22T10:01:10Z",
    "type": "dedup",
    "data": {
      "kept": "openalex:W3202525453",
      "merged": [
        "openalex:W3145849805"
      ]
    }
  },
  {
    "schema": "question_event@1",
    "run_id": "run-20261022-a1",
    "seq": 13,
    "at": "2026-10-22T10:01:10Z",
    "type": "stage",
    "data": {
      "stage": "search",
      "state": "end"
    }
  },
  {
    "schema": "question_event@1",
    "run_id": "run-20261022-a1",
    "seq": 14,
    "at": "2026-10-22T10:01:20Z",
    "type": "stage",
    "data": {
      "stage": "screen",
      "state": "begin"
    }
  },
  {
    "schema": "question_event@1",
    "run_id": "run-20261022-a1",
    "seq": 15,
    "at": "2026-10-22T10:02:00Z",
    "type": "verdict",
    "data": {
      "verdict": {
        "schema": "screen_verdict@1",
        "run_id": "run-20261022-a1",
        "key": "doi:10.1000/example.seasonal",
        "decision": "exclude",
        "reason": "Seasonal outlooks, not nowcasting.",
        "score": 0.06,
        "model": "strata-qwen",
        "batch_id": "b1",
        "plan_version": 1,
        "created_at": "2026-10-22T10:02:00Z"
      }
    }
  },
  {
    "schema": "question_event@1",
    "run_id": "run-20261022-a1",
    "seq": 16,
    "at": "2026-10-22T10:02:10Z",
    "type": "verdict",
    "data": {
      "verdict": {
        "schema": "screen_verdict@1",
        "run_id": "run-20261022-a1",
        "key": "openalex:W1485009520",
        "decision": "unscreened",
        "reason": "Batch b2 failed: context window exceeded.",
        "score": null,
        "model": "strata-qwen",
        "batch_id": "b2",
        "plan_version": 1,
        "created_at": "2026-10-22T10:02:00Z"
      }
    }
  },
  {
    "schema": "question_event@1",
    "run_id": "run-20261022-a1",
    "seq": 17,
    "at": "2026-10-22T10:02:20Z",
    "type": "state",
    "data": {
      "state": "paused"
    }
  },
  {
    "schema": "question_event@1",
    "run_id": "run-20261022-a1",
    "seq": 18,
    "at": "2026-10-22T10:02:50Z",
    "type": "state",
    "data": {
      "state": "running"
    }
  },
  {
    "schema": "question_event@1",
    "run_id": "run-20261022-a1",
    "seq": 19,
    "at": "2026-10-22T10:03:00Z",
    "type": "override",
    "data": {
      "override": {
        "schema": "screen_override@1",
        "run_id": "run-20261022-a1",
        "override_id": "o1",